{
  "payment_batch_id": "00000000-0000-0000-0000-000000000001",
  "organization_id": "00000000-0000-0000-0000-000000000001",
  "status": "failed",
  "action_date": "2021-09-29T09:36:43.560Z",
  "process_date": "2021-09-29T09:36:43.560Z",
  "payment_type": "debit_order_same_day",
  "payment_method_type": "debit_order",
  "billing_config_id": "00000000-0000-0000-0000-000000000003",
  "submitted_at": "2021-10-07T07:38:00.117Z",
  "submitted_by": {
    "type": "api_key",
    "id": "420df14d-b09d-4d89-84a8-8e3118c9ca23",
    "owner_id": "00000000-0000-0000-0000-000000000001"
  },
  "created_at": "2021-09-29T09:36:43.560Z",
  "failure_reason": "Failed validation",
  "num_payments": 10,
  "num_reviewed": 0,
  "total_value": 1000000,
  "external_reference": "ABCDE12345",
  "updated_at": "2021-10-07T07:38:00.117Z",
  "updated_by": {
    "type": "api_key",
    "id": "420df14d-b09d-4d89-84a8-8e3118c9ca23",
    "owner_id": "00000000-0000-0000-0000-000000000001"
  }
}